title,videoId,viewCount,likeCount,dislikeCount,commentCount,favoriteCount
Priya Varrier whatsapp status ,Xz9VgrT7upQ,24868,256,14,9,0
Top 100 Viral Videos of the Year 2017,cWiPROxS2HA,17285493,147192,11666,9266,0
Best Whatsapp Indian Viral Trending Funny videos -Try Not To Laugh,6clmHezY9TM,284697,279,169,31,0
Priya Prakash Varrier Full Video Most beautiful girl and eyes #trending,s9v3vUO9cfQ,17155,241,16,9,0
Trending Funny Videos 2017  You Will Die Laughing After Watching This  Try Not To Laugh Challenge,SV4gaKwlfR8,264117,313,129,32,0
#Trending || new crush of India || most viral video || cutest video on internet today [?]|| latest ||,4Wr7wxGt6a4,129852,1356,58,82,0
10 Weird Restaurants You Won't Believe Actually Exist,A6o3B8j0Ymc,2495474,5073,924,545,0
TOP TRENDING MAKEUP VIDEOS ON INSTAGRAM  | BEST MAKEUP TUTORIALS | #56,sy2a81z5Q_s,19326,367,22,18,0
Oru Adaar Love Romantic Remix Whatsapp Status Video Malayalam Oru Adaar love..,SwGRS1o_3ao,69252,385,28,8,0
Man Jumped into Tiger Enclosure at Zoo | Latest Trending Videos | AR Entertainments,l99RDAf7OHw,132571,62,30,8,0
#Trending || Priya P.Varrier || Most Viral video || Most search video on YouTube || cutest video ,2k8s3ZfpixE,312197,2482,197,109,0
Oru adaar love | Trending Romantic kerala song Ft-Shape of you song,_O8Pb1WbMZ4,7399,65,7,7,0
Trending videos of the week - Savage level 121% / try not to laugh hood edition / trending videos,j7elIC0wiW4,795954,5247,964,565,0
TOP TRENDING MAKEUP VIDEOS ON INSTAGRAM  | BEST MAKEUP TUTORIALS | #55,Y_-2U1zjSlU,73489,774,64,33,0
Best dangerous road in Nepal || Real video || YouTube trending video,Yh6_h3iGue4,7847,25,3,3,0
Most Funny Videos Indian Ever Seen in India | 2017 Whatsapp Funny Trending,vFJZakTlwOw,452006,285,180,13,0
YOUTUBERS REACT TO TOP 10 YOUTUBE VIDEOS OF 2017,Lr8VpJ2GX2E,3174667,68141,3096,6373,0
Filipino Vines  Filipino Laughtrip Compilation  Pinoy Trending Videos  Stupid and Funny People,aojgGbpsnAA,919667,976,314,65,0
Crocodile in Anaconda stomach | Trending on Youtube | Latest Videos,hWB8oRC6F4s,51587,56,22,19,0
Cute Girl Expression of the Year Priya Prakash | Viral Trending Video | Valentine's Day Special,QttBHAMGjTE,9316,81,8,4,0
Best WhatsApp Viral Trending Funny videos,FRJkTqZDjy8,3207,21,1,2,0
TOP TRENDING MAKEUP VIDEOS ON INSTAGRAM  | BEST MAKEUP TUTORIALS | #54,i7eTyeXl7ag,13531,249,12,11,0
GUJAR CHORI TOPPER AMIT BHADANA ||AMIT BHADANA VIDEO || FUNNY VIDEO || ON TRENDING || JMD,rOfny_N6ZB0,6492953,49608,2981,148,0
latest trending funny Indian videos,armMhJH3rDc,10749,17,9,1,0
New Funniest Video 2017  Best Funny Videos Ever | Top 10 Crazy Funny Videos   Try Not to Laugh,pYlHO8jTgms,6987948,6835,3007,386,0
Priya P.Varrier | Viral Wink Girl | Trending ALL VIDEOS | BEST OF PRIYA VARRIER Meme Compilation,m3mCIsZOSVc,122101,603,88,25,0
TOP TRENDING MAKEUP VIDEOS ON INSTAGRAM  | BEST MAKEUP TUTORIALS | #52,f5K6OtzjUFk,18000,295,12,18,0
Funniest Bisaya Interview 2017 Trending,fFoIr_Jt6qc,147180,543,57,201,0
Whatsapp Funny Videos 2017  Trending on Whatsapp This Year,4jO2AsV7Txk,114410,179,47,4,0
TOP TRENDING MAKEUP VIDEOS ON INSTAGRAM  | BEST MAKEUP TUTORIALS | #53,exFOL2Q-mIY,18038,290,19,16,0
Pinoy Trending Game Bato-bato Pick Challenge,l8Bw99GKbt4,952862,1065,218,51,0
New Whatsapp Status Trending. Omar Lulu Love || Priya Parkash Varrier || Latest Oru Adaar Love,aBL_COSq6sE,124060,715,44,33,0
Trending Now - Trending Videos In The World  | 10 Sep 2017,DI1yDeMdh7g,648,3,1,0,0
dekhiiye Trending Videos: Shruti Hassan shoNkiNg Hot Pictures Video !,VgHvsBhrwd4,199163,101,29,3,0
10 Shocking Videos Caught On GoPro,ctaHnYUDIqw,1728183,11832,739,926,0
Most viewed video on internet| viral video on internet| Today in trending|Boy and girl eye contact,Tv_FQkkz1jc,3902,35,2,3,0
Top Trending Videos This Week | Video Jukebox | Akhil | Jazzy B | Harsimran | Speed Records,NONukOiALAU,29199,1165,45,70,0
SNAKE ATTACKING VIDEOS COMPILATIONS 2017 TRENDING VIDEOS COMPILATIONS,T3XMi_IZB9k,560402,925,372,53,0
Rank  YouTube Videos on Trending Page in 12 Hours Very Advance Tutorial 2017,Tzq28Fe9b3k,58611,1489,561,479,0
Priya warrior video - Vera leval - new trending video,0Yg-6INHXiA,3058,12,0,0,0
TRENDING VIDEOS 2017 ( HANGA AKO SA BATANG ITO PARANG 50YRS OLD MAGSALITA),kQgeEZTHNgQ,112235,780,50,49,0
YouTube Unplugged Trending Videos & Channels !! Reaction Episode # 1,cQDfS2kljcc,25158,587,127,0,0
title,videoId,viewCount,likeCount,dislikeCount,commentCount,favoriteCount
Os videos EM ALTA no Japao,0ChMvWke16Q,152823,18949,187,892,0
Cute girl eyebrow up and down act Trending video | beautiful cute girl WhatsApp status video,211f2YnN1os,7792,87,5,5,0
Priya Prakash Varrier Unseen Videos&Photos collection||Priya Prakash||Trending videos||MVF,xUaEXiUUy1U,51,5,0,0,0
TOP TRENDING MAKEUP VIDEOS ON INSTAGRAM  | BEST MAKEUP TUTORIALS | #50,D-_PR3j1_iY,28043,399,14,23,0
Top Trending Videos Of The Week | Diljit Dosanjh | Amrit Maan | Sajjan Adeeb,nh5lMZB6ZUs,95896,2195,92,109,0
Make Videos on Trending Topic ? / How to Grow On YouTube | Talking About Tags and SEO,8qzZG72Muys,59064,2893,243,491,0
10 Richest Kids in the World,GGvZ6VeCMQ8,13059414,52432,5635,4253,0
World's Biggest FireCrackers Battle || Happy Diwali || # Trending Video,1GW_n-aAjM0,20372637,112826,24089,3219,0
National crush of India 2018|Priya Prakash|Top trending video,fC6q4pPnIco,7755,45,8,0,0
Ang galing!! |Trending videos Philippines 2017,LzjBXfiV1Eo,11940,62,1,1,0
Trending Videos ni Yna Magenda - HOTW #3,d1-ngvvVMEI,85965,1758,20,217,0
Trending Videos ( Random ) - Payasam Enga Da,YNGGb3H_HYo,854,180,5,18,0
"Most romantic & trending video ||Full HD video trending on FB ,tweeter, Insta...",mk9zkf8CpsQ,208,5,0,1,0
"Pinoy Funniest Video 2017,   Pinoy Viral Videos , Pinoy  Vines Videos 2017 Compilation",bN3TnGnKBcA,189284,204,39,23,0
Best Hilarious Videos - Try Not to Laugh or Grin - Clean Funny Videos - Funny Trending Videos ,Fk3SAYDCVM4,500126,974,206,28,0
Top 10 Globally Trending YouTube Videos Of 2017,aJb0jiezvYw,620,9,1,2,0
Trending videos in Kenya - Nairobi Phone Robbery.,G1vMC8MDwfk,953,3,1,2,0
Trending Kerala Girl - Today Viral Video,nFxHRKhqdns,1588,14,2,3,0
Wild Animal ATTACKING Trending videos compilations 2017 fail videos,HW9S3RbCw00,18691,21,6,2,0
Pinoy Trending Videos  Filipino Laughtrip Compilation  Filipino Vines  Stupid and Funny People,p9deyy1Dey8,37679,100,23,1,0
Priya Prakash Varrier Song | Valentine Day Special | Oru Adaar Love Official Teaser,RskiwRBnLYo,46303,492,30,51,0
[Hindi - hindii] How to Get Trending Topic For Youtube Videos || Make a Viral Video - 2017,MAFd0rptqCo,14675,614,103,122,0
Funny Videos Of The Week - Try Not To Laugh! It's Trending Now!,45eIrrSt2o8,49893,76,13,6,0
The Top 5 FAIL ARMY Videos of All Time | What's Trending Original,gnCuD-c-lRI,17097,142,23,24,0
WhatsApp Trending Videos - Baby Crying,O3JSmd_rKIw,3477,17,0,1,0
Youtube - Trending Videos,HGjCqo1L6eY,127969,1567,44,39,0
TOP TRENDING MAKEUP VIDEOS Feb 2018,vdpXIUwgnJQ,3305,82,9,8,0
TRENDING!! PAUL SALAS SCANDAL VIDEO!! ,1ao9oHg53os,536049,175,125,16,0
Trending Video: Talented Teenager Be like,OP8qmT7Cg7o,59213,573,12,29,0
How To Get Your Video TRENDING On Youtube's Trending Page,29MAn14ORms,125447,2121,185,257,0
Most Funny Trending Videos On Facebook,NDjxS02lFik,3568,26,3,4,0
Today Trending Videos And News | Sai Pallavi | Prabhas | Anushka | Telugu Full Screen,R_trd4Sze_c,83082,189,50,4,0
title,videoId,viewCount,likeCount,dislikeCount,commentCount,favoriteCount
The Voice Kids | TRENDING Blind Auditions,3PUdh_yo-V8,12039378,47992,4046,3117,0
My 1st Video Hit TRENDING on Youtube!,J4UuuBu1gOY,125710,5807,219,517,0
Best Trending Viral Videos of the Week || Sling Blade Style,uZ2NVtOL3Q4,555305,4254,177,282,0
Eto Yung Maganda Na May Talent Pa [?][?],ObFfCZgbO-0,101652,1722,19,82,0
"Ralo ""Trending Freestyle"" (Moneybagg Yo Diss) (WSHH Exclusive - Official Music Video)",Fto307pFXww,360899,6467,796,1017,0
"TRENDING! Priya Prakash Varrier Height, Weight, Biography Etc?? #Priya Prakash Videos #Priya",We2qdSuxk9k,368,4,2,0,0
Trending Whatsapp Funny Video # 64 | Funny Videos Compilation 2015,cdNc8jBtwuk,17761,5,5,0,0
Best Trending Videos of the Month January 2015 || JukinVideo,xjnvkQt9__w,937088,5173,329,206,0
Actress Trisha Personal Tattoo Pics Leaked || Telugu Trending Videos,_eRVwxFiCQk,38306,16,8,0,0
"Trending Videos of the Week - Wednesday, November 12-19th",bvyutQp212k,319553,290,65,24,0
TOP TRENDING MAKEUP VIDEOS ON INSTAGRAM  | BEST MAKEUP TUTORIALS | #51,dLLdObXv7UY,11650,223,8,15,0
Funny Fails Videos Try To Not Laugh Challenge Funny Vines Instagram Viral Video Its Trending,jbm_Y48By0s,25497,173,9,6,0
Vijayakanth version Troll - Trending Whatsapp Video | Kerala Girl Priya and Prakash | Oru Adaar Love,AzJjeTb_T_I,1760,15,1,0,0
Stupid and Funny People - Filipino Vines - Pinoy Trending Videos - Try Not to Laugh or Grin ,41XtK5ZdQLk,29155,104,13,1,0
Crush Of the Year |Priya Prakash|Kerala| Top Trending Instagram video| best scene for Valentine's,UfMXTUMy7cs,2942,39,1,0,0
How To Make Video Viral | Video Editing And Trending | Trending Videos,-HyQTtjb5Fw,9786,281,12,26,0
How To Make Trending Video On YouTube In Make Viral Video Grow Channel Fast,pYBms9Ah3Q8,20401,0,0,361,0
Watch the top trending videos of the week in 1 minute,-QtAHRZ0mFE,1671,2,2,0,0
Banana Sundae: BananaKada spoofs the trending video about a girl and her helmet,sy28eeE4dD8,83,4,0,1,0
Filipino Laughtrip Compilation  Pinoy Trending Videos  Filipino Vines  Stupid and Funny People,9ySzuwx1S0s,4550,16,4,0,0
Trending videos on the net,S-SjuvO32A8,1075,6,1,0,0
YOUTUBE TRENDING PAGE,qDA34A5JRYY,1853324,182661,3793,10946,0
#1 Trending Cute Love whatsapp Status Video - Valentines Day 2018 Special Video,J4AiZTiBV2w,2074,16,0,1,0
How to Trending Your video on YouTube | How to Get YouTube VERIFIED BADGE | TIPS IN HINDI,80Bsng8zkL4,8608,81,146,31,0
title,videoId,viewCount,likeCount,dislikeCount,commentCount,favoriteCount
MOST TRENDING VIDEOS 2017,ncB7M7pNVjU,619,1,0,0,0
How To Find Top Trending Videos with vidIQ,o-Uo1at-6gU,3938,107,6,47,0
New whatsapp status 2018 || Trending videos,uwA489m1cwc,21,0,0,0,0
Most Trending Videos || Angor Story a Rich Man || SRY TV,1uDNZ8X-ljg,52,1,0,0,0
Priya Prakash Varrier is 2018's first viral sensation / Trending Dubs Videos,vUjDUEkY-XM,640,19,5,0,0
Trending l Viral Videos l Manikya Malaraya Poovi l Watsapp l Youtube l Facebook l in India 2018,P-pFiwwaWsM,93,37,0,0,0
Video me scrolling tex kaise likhte hai | Trending Videos,7z7HsvtvpQU,27,1,0,0,0
Watch the top trending videos of the week in under 1 minute,nB1MS19mDP4,21711,16,3,3,0
salman khan madlipz videos in hindi | trending videos,Qxjz87azfvA,75894,128,7,1,0
Chupna bhi nahi ata..  Trending video in social media priya Prakash varrier cute love story,IhWjaImU4Fs,427,3,0,0,0
Priya P.Varrier || NEW VIDEO CLIP || VIRAL WINK GIRL TRENDING || Ankhiyon Se Goli Maare,sl35LVVOhUo,7885,37,6,2,0
must watch #trending in kenya,mAGDblPA2BY,33053,17,9,5,0
"Funny, Trending, Comedy, Viral Videos!",iJ9Wyn25qdU,3354,7,0,0,0
TOP 5 TRENDING VIDEOS in INDIA TODAY,rLpkEpQd88s,350,0,0,0,0
It's Showtime: Vice and Vhong imitate 'Nung Ako'y Bata Pa' trending video,tshSEuD2XVg,2428368,12905,342,545,0
Salman Khan Rajinikanth Shahrukh Khan Videos | Top Trending Videos 2016,Dhx3JbEnGBo,2216,26,0,5,0
MICHAELA CABALLERO BALDOS - (SPEECH PHOTO) - REGARDING THE TRENDING VIDEOS,ynmEWRETRcQ,405331,164,282,0,0
How To See #Trending Videos | Of Any Other Countries |Rao Dhruv Tutorials| In Hindi|,stfPsdm1bRE,365,12,6,1,0
How To Get Your Video Trending On Youtube In India | Hindi,OTjRCdzH7Lc,5574,93,111,47,0
How to create trending videos [Tamil] Part - 27,m1rqIPSBcCI,1563,21,0,0,0
Top 5 Trending Videos in Greece This Week,qrFbLfp4H4Q,1496,81,3,39,0
Dua Lipa - IDGAF (Official Music Video),Mgfe5tIwOj0,98042691,1810811,55778,71083,0
How To Rank YouTube Videos Higher For Trending Topics,qIaAJ4jxbcw,493,39,0,67,0
Trending videos of the week - Savage level 100 %25 - try not to laugh hood edition - trending videos,fqp8IWid7g0,606,18,0,2,0
title,videoId,viewCount,likeCount,dislikeCount,commentCount,favoriteCount
Ang dahilan kng bakit naging viral ang video ni MICHAELA CABALLERO BALDOS,J93r6Vqe2UA,623328,431,242,260,0
MIKAELA BALDOS TRENDING VIDEO,Xai10nIaaAU,62085,70,70,38,0
Priya Prakash Varrier Part 2 | Full Video HD | Trending Videos,W2Rxnwal-gU,5,0,0,0,0
PINOY TRENDING VIDEOS - PHILIPPINE LADIES CRAZY FUNNY GAME,i7Hg3ML6BEg,4373,1,0,2,0
How to watch Trending Videos of other Countries,FEPqT5YvNZE,138,11,1,8,0
Priya prakash verari | funny edits | an omar love | mosts trending videos | status video,zuaVJv8f3KY,282,16,1,3,0
Top Trending Challenge Dance Compilation #trendingchallenge #litdance,HaDXff_Vj0U,443818,5133,95,265,0
Do not Laugh or Grin - Laugh Factory - Filipino Funny Videos - Pinoy Trending Videos - Vines Funny,2_My1Aqa_gY,1844,25,1,2,0
Top Trending Videos On INSTAGRAM,DTr5KXoQxTY,46825,208,40,27,0
Top Trending Videos | Dani Rovira | El Club de la Comedia | Colegio,Ecm6W2E0k1I,7926,13,5,0,0
Morlo Tahuka Karto Jay Re | Dandiya Raas Garba | Gujarati | Trending Videos 4u,V-ilaKfdARo,12757,67,2,15,0
Mila Video Mila Makes Her Siblings Christmas List Instagram Stories Funny Viral Videos Trending,u9jqEdvfcnc,23158,383,11,17,0
MICHAELA BALDOS | TRENDING VIDEO,E6GIuIuFDPI,200973,46,35,3,0
Priya Prakash Varrier Part 1 | Full Video HD | Trending Videos,sJX4ksUGCiQ,7,0,0,0,0
Viral Funny Videos Of The Week 2016 - Trending Now!,a9m-XIiuSKA,11631,57,9,2,0
Pinoy Viral Videos 2017 Compilation Facebook Viral VideosTweeter Trending Videos Funniest Video,pT8Nr0y3YqY,5456,7,5,1,0
Soulja Boy * Trending Topic (Official Music Video),I0mdj6Ym0c4,124200,1981,43,79,0
Priya varrior  funny videos ||Trending video,Y09xdpmHkXM,51,3,1,0,0
The disturbing YouTube videos that are tricking children - BBC Trending,acTcMUJ6qBI,351811,4932,511,2435,0
How to Watch Trending Videos of Youtube of Any Country in Mobile Without VPN  | Android and Ios,toZIe5CEToo,844,24,4,8,0
Indias most trending video||priya prakash varrier||Mr.bean||troll video,u3yAnUQS734,15497,157,6,0,0
A Must Watch Short Film Funny and Trending Videos | Best Funny Video Ever,kPMFat8pIPw,57,0,0,0,0
WhatsApp status Tamil trending video troll video oru adaar love,kn6sm9KkcI8,1689,11,2,2,0
WhatsApp status Tamil trending video Malayalam song remix oru adaar love,PS8OI5ITnsc,2806,20,0,0,0
Top Trending Portal - Maniac sa FX Huling Huli kumukuha ng video dahil sa Flashlight ng Phone,hCISJp-yMok,63616,18,9,14,0
Trending Now - Trending Videos In The World |  27 Feb 2017,Fx4Ik6Vbh58,727,0,0,0,0
"YouTube, Low Earnings in July, Trending Videos, Ads impression & Update - Live",TvREzAuUMw8,1677,82,23,72,0
Epic Vine Compilation 2014 - Trending Vine Videos - March 2014,NHD4oyiVVOQ,96953,451,34,30,0
Sibahle Uzalo Killing SA Dance Moves By SA Trending Videos 1,gk_G15LufEw,804,6,0,0,0
"Trending Now - Trending Videos In The World | Aug 02, 2016",eiK5n7UNo6U,62,0,0,0,0
title,videoId,viewCount,likeCount,dislikeCount,commentCount,favoriteCount
Priya prakash trending viral video eye expression,9mbEQUaQ36k,1949,12,1,0,0
Top Views Video On Youtube In Nepal | Top Trending Videos In Nepal: This Month,fMctLFxtPUE,119,2,2,0,0
The Trending Girl Priya Prakash viral video,Pd2uPthzM9E,445,6,1,0,0
Priya Prakash Warrier Latest Dubsmash HD | Trending Videos,9Ry_fShJIKs,1,0,0,0,0
How To Change Your  Youtube Trending Videos,OvCflkDcVcY,1894,7,17,1,0
Video Content Ideas! Find Trending Video Topics with Keyword Tools,EdE4zzKBE4w,1700,96,3,41,0
Why is this Video on the TRENDING Tab???,n42JN-TMSkk,6136325,855622,6400,33587,0
Emma And Mila Videos Become Viral On Right This Minute | Funny Videos Instagram Viral Stories Trends,J1CMv85j49s,373891,2480,98,58,0
how to create trending videos in practice [Tamil] Part - 28,56wqBvN1ZsA,1156,26,2,3,0
Top trending videos on YouTube india #thrilling #trending #india #amazing #best #thrilling,thtuzXw0yE0,583,4,0,0,0
Oru Adaar Love best romantic scene of school days | Most Trending Video in the Valentine's Week!,A_ipPV0fR00,34,0,0,0,0
BUTI MAJULI AND HIS FANS # YENA AYA KWINI TRENDING VIDEOS,S6-qD1RGM6U,84394,244,24,6,0
Cute girl Expression of the year Priya Prakash varrier/ Facebook Trending video / Valentine's Day,uDfv3MTnKtA,1044,8,1,1,0
Zilipendwa ya WCB yaipiku Seduce Me ya Alikiba kwenye Trending Videos za Tanzania,wqTv8SMY4-A,12541,73,26,38,0
funny  trending videos of the week,h5Cllj5GgU8,610,1,0,0,0
"Trending Now - Trending Videos In The World |Jan 08,2017",oglNnpp3bvE,375,3,0,1,0
Today Trending Videos | Jr. NTR | Mahesh Babu | Ram Charan | Telugu Full Screen,_4VrHVPfI_0,1648,31,0,5,0
Priya Prakash latest trending videos,Uza9ehhops0,5,0,0,0,0
Priya prakash varriar | Oru adaar love video | Trending video | Valentines day | School love story,8fndHBmddFk,378,9,0,0,0
Oru Adar love| The trending video on internet | Romantic | Priya,chnRr658Ygc,466,16,0,0,0
filter copy/All trending videos /ft.chetan,49ECBUDg_ow,0,0,0,0,0
TRENDING VIDEOS OF THE WEEK !!,iC5aai_n4x0,284,2,0,0,0
World Trending Girl Video || Priya Prakash Varrier || Actress Malayalam 2018,FNMTVFxvqN0,20621,232,10,7,0
TRENDING Indian Funny viral Videos 2017 Try Not To Laugh India#8,uEccDNX9mtk,14156,2,4,3,0
This Baby Lion wants to Roar - 100 Trending Videos,sdat-KPtlgY,17080,8,0,0,0
Vice Ganda gets mad at Vhong,sDEWqTpjKBM,5009763,26740,905,1780,0
Emma And Mila on Right This Minute | Mila Viral Videos | Instagram Stories Trending,A1ZvLRTWwI8,22939,408,9,41,0
Trending Now - Trending Videos In The World | 08 May 2017,ljWK38m5CPA,390,0,0,0,0
title,videoId,viewCount,likeCount,dislikeCount,commentCount,favoriteCount
Top 10 Trending Videos Funny Crazy,npbu_sg2-2Q,2545,3,3,0,0
apnii Video ko Trending meN kaisai laaye // 0 Views meN / 100% Working / Trending Video/ ,kH4S3oaCXsg,58,29,1,16,0
Murghi Story - Sweetest Kiss | Trending Videos |,DMY4dyjKZt8,6,3,0,0,0
Kitang-Kita Kita : Pinoy Viral Trending Videos Compilation 2017,yU2zT_R80y4,876,1,0,0,0
priya prakash varrier | viral wink girl | Trending ALL VIDEOS | BEST OF PRIYA VARRIER | Rajparihar,R4l0oQUbaV4,26,2,0,0,0
Una tormenta con rostro humano - trending videos en www.toppli.com,SmadC0Ta5VE,1223016,2085,69,566,0
YouTube top 10 Trending Videos 2017 | Viral Videos,ICmjK_CbmbM,218,0,0,0,0
TOP TRENDING CHALLENGE DANCE COMPILATION - LIT DANCE OF December 2016 #TrendingVideos #Litdance,sFXvJUzs9ZU,31224,364,7,43,0
Pinoy Trending Videos - Boy Landi (Drew Olivar) - Miss Gay Philippines,OvLx1GhbZvo,68072,95,20,26,0
Cheez Badi | Dance Tutorial | Youtube India Top 10 Trending videos of 2017 | @JeyaRaveendran,ayDLRLhhL9w,36158,1146,26,122,0
Top 5 Trending videos  | Most Viral  |  India 2017,AmhQykE0bRU,2154,7,6,0,0
Viral And Trending Videos | What's Going On Between Saroj and Sabin |,v2fn0qxqkEQ,176073,1829,195,458,0
Ayesha Takia hot tight dress | photoshoot | Trending videos,KyB7mSUSyIw,2796,2,0,0,0
top trending videos in telugu by desi bharath channel || 4 viidhi kukkl rkssnnloo ok cinnaari paap ||,d1M7bSAKpD8,1259,34,2,3,0
6 Most Disturbing YouTube Videos Of All Time,6pMZ3_o1YGs,4127668,23098,2239,4789,0
2nd CHANNEL! SUBSCRIBE IF YOU LIKE TRENDING VIDEOS!,qres3OqDM98,3367,62,11,15,0
#2 trending videos #priyaprakashwarrier,bW2VO71kBnk,3,0,0,0,0
Trending whatsapp status videos | full attitude video,bka72gyVUgY,19,6,0,4,0
Top Trending Videos This Week | Video Jukebox | Akhil | Jazzy B | Harsimran | Speed Records,dl7cAfiMi8U,5,0,0,0,0
YouTube Algorithm 2018 - Trending Videos Tab (5/7),rmLlaEHLCCU,170,9,1,15,0
title,videoId,viewCount,likeCount,dislikeCount,commentCount,favoriteCount
TOP TRENDING VIDEOS OF TODAY. Benjamin Deneke Show,8CIhkYV7_RM,37,7,0,0,0
"TODAY'S TOP5 TRENDING VIDEOS ON YOUTUBE 17-07-2017, 15:00HRS IST 10,022,578 views",KZ8ckalyKc0,38,0,1,0,0
School Love whatsapp status video | Most trending whatsapp status |priya prakash varrier,6qljlD-DakU,1165,21,0,0,0
Trending videos... Smartness overloaded,of8lMTqzy08,2,0,0,0,0
How YouTube's Trending Tab Works,GZmGmkOJ9ME,44732,534,140,132,0
REACTING TO TRENDING VIDEOS,zaNUe8VCJYU,141,25,0,4,0
TOP 5 TRENDING VIDEOS,3KzCvrHnPlg,669,54,0,4,0
Watch the top trending videos of the week,bNtotJ2RT-Q,16903,13,9,4,0
TRENDING VIDEOS OF THE WEEK JUNE 2017 #TRYNOTOLAUGHCHALLENGE - HILARIOUS VINES,ek14kp84Z7M,6341,84,8,8,0
Pinoy Trending Videos - Boy Landi (Drew Olivar) - Pabebe dance craze,gw0LBqaXDpI,2542,20,4,3,0
Funny WhatsApp Video @Trending Videos-----latest Funny Videos --whatsapp naughty,42r1yYWUi9A,2791,5,1,0,0
Filipino Laughtrip Compilation - Stupid and Funny People - Filipino Vines - Pinoy Trending Videos,H-vcqZfqP34,160656,249,48,3,0
Listen to Kim Domingo sing in Videoke trending videos,2asqCtarMV4,8408,31,4,9,0
ALL THESE  EDITED TRENDING VIDEOS...,AkZ6kY_gnRQ,901,13,3,3,0
"Pinoy Trending Videos - Boy Landi (Drew Olivar) - Okrayan ng mga bakla, bi, trans etc",p7g3iyVFfKs,4709,20,1,2,0
Poland Girl and Guntur Boy Marriage FULL VIDEO | Indians Marrying Foreigners | Trending Videos,ldhkQgkGXHc,10538,60,11,13,0
TOP TRENDING VIDEOS ||  MOST WATCHED VIDEOS IN THE WORLD ||,7E4_uQntOr0,147,20,0,58,0
TOP TRENDING VIDEOS FOR DIABETES - #Orangehealth #DiabetesCareCulb,nUlkrxUzqXY,1956,51,6,4,0
How(Trick) to get my video on YouTube Trending (Hindi/Urdu)- OFFICIAL,jmy93tjtN8s,1365,23,14,2,0
Trending videos,9TqETXv3Mw0,67,4,0,1,0
title,videoId,viewCount,likeCount,dislikeCount,commentCount,favoriteCount
Pinoy Trending Videos - Boy Landi (Drew Olivar) - My 1st Gwiyomi Version,YvZa5Cmr-AA,11736,37,4,4,0
HOW TO MAKE TRENDING VIDEOS FOR YOUTUBE,uKf9rVONtUE,389,3,5,0,0
Trending Videos of the Week - July Week 4 | Digital Minds,QGZDkX830Uo,8441,16,3,2,0
Trending Videos of the Week - July Week 5 | Digital Minds,SuC8nc0qy68,8467,16,3,1,0
Pinoy Trending Videos - Boy Landi (Drew Olivar) - Ito na mga teh Flashlight nanaman,qZywRzrnsY4,100685,505,37,124,0
Grabe! Dami ko tawa dito   Trending Pinoy Videos   Facebook,ZUVhv7V07XA,1939307,2623,450,176,0
trending videos in facebook,2qcrOXofZxQ,2973,10,3,0,0
Pinoy Trending Videos - Boy Landi (Drew Olivar) - Hoy jessica soho,536_0s-kQzg,8633,54,4,2,0
Pinoy Trending Videos  Filipino Vines  Filipino Laughtrip Compilation  Stupid and Funny People,dNY_42m7h4o,34605,89,10,3,0
Top 5 Trending Video | Video Jukebox | Punjabi Songs Collection | Speed Records,14L1DZ917t0,200304,516,72,18,0
Top Trending Videos on YouTube | Popular Videos 2017,2kSmsAM0iCI,1257,0,2,0,0
Pinoy Trending Videos - Boy Landi (Drew Olivar) - JOWA PA MORE,XQX8GmH1D-A,7074,58,2,13,0
Pinoy Trending Videos - Boy Landi (Drew Olivar) - Boy Landi Pabebe,vKuq-lbxs3M,22636,105,7,11,0
Pinoy Trending Videos - Boy Landi (Drew Olivar) - BOY GIRL BAKLA charice,xQqkzHZAAXg,7461,37,3,2,0
title,videoId,viewCount,likeCount,dislikeCount,commentCount,favoriteCount
AGSM - The secret world of animated doll videos on YouTube - BBC Trending,ua5bW2MQRFE,59103,1175,16,414,0
TOP TRENDING videos of PRESIDENT DONALD TRUMP THAT GOES VIRAL IN 2017,WFO5yFp6W9Q,104,4,0,2,0
How To Watch Other Country Trending Videos ?? Explained ....,Cc7mhmeKUJk,157,1,1,0,0
USA Top 5 Trending Videos on YouTube || viral videos,x-IoPjsodrI,191,3,0,0,0
"ivvi - The app to see, save and share trending videos",WWqFbWOHSMQ,1031,2,1,0,0
Discover Trending Videos via YouTube Trending tab | lfydywht l'kthr sh`by@ | Zui moRen Qi noaruDong Hua  | zaffron,Biqy9NPm5Mk,333,28,0,36,0
Trending videos with a little humor,OFkC3jsBxfM,543,0,1,0,0
(Weird Trending Videos #1)BBC WORKER WATCHES INAPPROPRIATE VIDEO *Live*,MXj3w37JMAg,2289,25,0,8,0
Funniest Trending Videos On YouTube!,IMRbxCSL3vw,282,11,1,3,0
TOP 10   Today's Trending videos on YouTube,-qCrwLtljfY,116,0,0,0,0
Shruti Haasan Hot Sexy Wardrobe  | Trending videos,MX0hiao8Vj0,2126,2,1,0,0
SHOPLIFTER (Pinoy Trending Viral Videos),idPrVpJ67c8,22319,6,6,1,0
Alia Bhatt Hot Workout Latest Video - Trending videos,FvumBtNlFhA,901,0,2,1,0
happy dussehra 2017 | Rawan Dahan 2017 | Trending Video,t4AgjZPgtgE,62355,145,34,26,0
Rakul Preet Singh Latest Bi Ki Ni Video || Rakul trending Videos,D2HhPwvlNMQ,518660,469,115,17,0
YOUTUBE REWIND top 10 trending videos 2016 YOUTUBE IS LYING? RANT (MUST WATCH),Vz-Qjb2At1E,199,60,2,86,0
Watch the top trending videos of the week,Lq4zNXnFVhQ,3432,4,1,1,0
title,videoId,viewCount,likeCount,dislikeCount,commentCount,favoriteCount
TOP 10   Today's Trending videos on YouTube,-qCrwLtljfY,116,0,0,0,0
Shruti Haasan Hot Sexy Wardrobe  | Trending videos,MX0hiao8Vj0,2126,2,1,0,0
happy dussehra 2017 | Rawan Dahan 2017 | Trending Video,t4AgjZPgtgE,62355,145,34,26,0
YOUTUBE REWIND top 10 trending videos 2016 YOUTUBE IS LYING? RANT (MUST WATCH),Vz-Qjb2At1E,199,60,2,86,0
[Explained] YouTube Algorithm for Trending videos -So simple!,SRp9kYQc2FY,154,10,2,1,0
Watch the top trending videos of the week,Lq4zNXnFVhQ,3432,4,1,1,0
Fish trapped by bird! | Animal Intelligence | Trending Videos | Latest video on youtube,LMpyD4Ac4ZQ,245,1,0,0,0
Priya Prakash Warrior Sexy MMS Viral Video 2018 | Trending Videos,pjDzZOt9jYU,8136,23,9,3,0
most funny trending video,5HMvsaAB1WQ,677,17,0,0,0
Tamil actress caste - trending videos,slDmUn2q-Yc,5321,13,10,0,0
TOILET ||TRENDING VIDEOS & SHORT FILM || Swachh Bharat || Swachata ke Thekedar || clean india,l_X2h6Ko-tc,2482,30,3,3,0
YAYA DUB & NOEL YOYO DUB (TRENDING VIDEOS),SL7_i63nBko,2154,43,1,9,0
How to check trending videos on facebook I Facebook FAQs,65AmXOAozDc,213,0,1,0,0
Trending Videos of the Week - March Week 3 | Digital Minds,cxIwUxm8yC4,8126,17,1,3,0
Rakul Preet Singh Latest Bi Ki Ni Video || Rakul trending Videos,D2HhPwvlNMQ,518660,469,115,17,0
